{
  "kind": "Recommendation",
  "schemaVersion": "0.1.0",
  "id": "rec_example_pricing",
  "projectId": "proj_example_petsit",
  "category": "PRICING",
  "title": "Start with a per-booking commission",
  "summary": "Charge a commission per completed booking rather than a sitter subscription.",
  "rationale": "Aligns cost with delivered value while supply is thin. Supported by one observed competitor claim; commission rate still unresearched.",
  "options": [
    { "id": "opt-commission", "title": "Per-booking commission", "pros": ["Aligns cost with value"], "cons": ["Revenue depends on marketplace liquidity"], "chosen": true },
    { "id": "opt-subscription", "title": "Sitter subscription", "pros": ["Predictable revenue"], "cons": ["Barrier for new sitters"], "chosen": false }
  ],
  "supportingClaimIds": ["claim_example_pricing_1"],
  "assumptionIds": ["asm-1"],
  "evidence": "INFERRED",
  "confidence": "LOW",
  "unresolved": ["Commission rate not yet researched."],
  "status": "ACCEPTED",
  "decision": { "basis": "USER_APPROVAL", "decidedBy": { "actorType": "USER", "actorId": "user_example" }, "decidedAt": "2026-09-02T15:00:00Z" },
  "createdAt": "2026-09-02T13:00:00Z"
}
